arXiv:1703.09550	Important New Developments in Arabographic Optical Character Recognition  (OCR)	https://arxiv.org/pdf/1703.09550.pdf	Maxim Romanov, Matthew Thomas Miller, Sarah Bowen Savant, Benjamin Kiessling	https://arxiv.org/find/cs/1/au:+Romanov_M/0/1/0/all/0/1,https://arxiv.org/find/cs/1/au:+Miller_M/0/1/0/all/0/1,https://arxiv.org/find/cs/1/au:+Savant_S/0/1/0/all/0/1,https://arxiv.org/find/cs/1/au:+Kiessling_B/0/1/0/all/0/1	Computer Vision and Pattern Recognition (cs.CV)	https://arxiv.org/abs/1703.09550.pdf
arXiv:1703.09529	Objects as context for part detection	https://arxiv.org/pdf/1703.09529.pdf	Abel Gonzalez-Garcia, Davide Modolo, Vittorio Ferrari	https://arxiv.org/find/cs/1/au:+Gonzalez_Garcia_A/0/1/0/all/0/1,https://arxiv.org/find/cs/1/au:+Modolo_D/0/1/0/all/0/1,https://arxiv.org/find/cs/1/au:+Ferrari_V/0/1/0/all/0/1	Computer Vision and Pattern Recognition (cs.CV)	https://arxiv.org/abs/1703.09529.pdf
arXiv:1703.09507	L2-constrained Softmax Loss for Discriminative Face Verification	https://arxiv.org/pdf/1703.09507.pdf	Rajeev Ranjan, Carlos D. Castillo, Rama Chellappa	https://arxiv.org/find/cs/1/au:+Ranjan_R/0/1/0/all/0/1,https://arxiv.org/find/cs/1/au:+Castillo_C/0/1/0/all/0/1,https://arxiv.org/find/cs/1/au:+Chellappa_R/0/1/0/all/0/1	Computer Vision and Pattern Recognition (cs.CV)	https://arxiv.org/abs/1703.09507.pdf
arXiv:1703.09499	Locally Preserving Projection on Symmetric Positive Definite Matrix Lie  Group	https://arxiv.org/pdf/1703.09499.pdf	Yangyang Li, Ruqian Lu	https://arxiv.org/find/cs/1/au:+Li_Y/0/1/0/all/0/1,https://arxiv.org/find/cs/1/au:+Lu_R/0/1/0/all/0/1	Computer Vision and Pattern Recognition (cs.CV)	https://arxiv.org/abs/1703.09499.pdf
arXiv:1703.09474	Robust Depth-based Person Re-identification	https://arxiv.org/pdf/1703.09474.pdf	Ancong Wu, Wei-Shi Zheng, Jianhuang Lai	https://arxiv.org/find/cs/1/au:+Wu_A/0/1/0/all/0/1,https://arxiv.org/find/cs/1/au:+Zheng_W/0/1/0/all/0/1,https://arxiv.org/find/cs/1/au:+Lai_J/0/1/0/all/0/1	Computer Vision and Pattern Recognition (cs.CV)	https://arxiv.org/abs/1703.09474.pdf
arXiv:1703.09471	Adversarial Image Perturbation for Privacy Protection -- A Game Theory  Perspective	https://arxiv.org/pdf/1703.09471.pdf	Seong Joon Oh, Mario Fritz, Bernt Schiele	https://arxiv.org/find/cs/1/au:+Oh_S/0/1/0/all/0/1,https://arxiv.org/find/cs/1/au:+Fritz_M/0/1/0/all/0/1,https://arxiv.org/find/cs/1/au:+Schiele_B/0/1/0/all/0/1	Computer Vision and Pattern Recognition (cs.CV)	https://arxiv.org/abs/1703.09471.pdf
arXiv:1703.09470	Learned Spectral Super-Resolution	https://arxiv.org/pdf/1703.09470.pdf	Silvano Galliani, Charis Lanaras, Dimitrios Marmanis, Emmanuel Baltsavias, Konrad Schindler	https://arxiv.org/find/cs/1/au:+Galliani_S/0/1/0/all/0/1,https://arxiv.org/find/cs/1/au:+Lanaras_C/0/1/0/all/0/1,https://arxiv.org/find/cs/1/au:+Marmanis_D/0/1/0/all/0/1,https://arxiv.org/find/cs/1/au:+Baltsavias_E/0/1/0/all/0/1,https://arxiv.org/find/cs/1/au:+Schindler_K/0/1/0/all/0/1	Computer Vision and Pattern Recognition (cs.CV)	https://arxiv.org/abs/1703.09470.pdf
arXiv:1703.09438	Octree Generating Networks: Efficient Convolutional Architectures for  High-resolution 3D Outputs	https://arxiv.org/pdf/1703.09438.pdf	Maxim Tatarchenko, Alexey Dosovitskiy, Thomas Brox	https://arxiv.org/find/cs/1/au:+Tatarchenko_M/0/1/0/all/0/1,https://arxiv.org/find/cs/1/au:+Dosovitskiy_A/0/1/0/all/0/1,https://arxiv.org/find/cs/1/au:+Brox_T/0/1/0/all/0/1	Computer Vision and Pattern Recognition (cs.CV)	https://arxiv.org/abs/1703.09438.pdf
arXiv:1703.09436	Evaluation of Classifiers for Image Segmentation: Applications for  Eucalypt Forest Inventory	https://arxiv.org/pdf/1703.09436.pdf	Rodrigo M. Ferreira, Ricardo M. Marcacini	https://arxiv.org/find/cs/1/au:+Ferreira_R/0/1/0/all/0/1,https://arxiv.org/find/cs/1/au:+Marcacini_R/0/1/0/all/0/1	Computer Vision and Pattern Recognition (cs.CV)	https://arxiv.org/abs/1703.09436.pdf
arXiv:1703.09393	Mixture of Counting CNNs: Adaptive Integration of CNNs Specialized to  Specific Appearance for Crowd Counting	https://arxiv.org/pdf/1703.09393.pdf	Shohei Kumagai, Kazuhiro Hotta, Takio Kurita	https://arxiv.org/find/cs/1/au:+Kumagai_S/0/1/0/all/0/1,https://arxiv.org/find/cs/1/au:+Hotta_K/0/1/0/all/0/1,https://arxiv.org/find/cs/1/au:+Kurita_T/0/1/0/all/0/1	Computer Vision and Pattern Recognition (cs.CV)	https://arxiv.org/abs/1703.09393.pdf
arXiv:1703.09379	Robust Guided Image Filtering	https://arxiv.org/pdf/1703.09379.pdf	Wei Liu, Xiaogang Chen, Chunhua Shen, Jingyi Yu, Qiang Wu, Jie Yang	https://arxiv.org/find/cs/1/au:+Liu_W/0/1/0/all/0/1,https://arxiv.org/find/cs/1/au:+Chen_X/0/1/0/all/0/1,https://arxiv.org/find/cs/1/au:+Shen_C/0/1/0/all/0/1,https://arxiv.org/find/cs/1/au:+Yu_J/0/1/0/all/0/1,https://arxiv.org/find/cs/1/au:+Wu_Q/0/1/0/all/0/1,https://arxiv.org/find/cs/1/au:+Yang_J/0/1/0/all/0/1	Computer Vision and Pattern Recognition (cs.CV)	https://arxiv.org/abs/1703.09379.pdf
arXiv:1703.09342	Graph Regularized Tensor Sparse Coding for Image Representation	https://arxiv.org/pdf/1703.09342.pdf	Fei Jiang, Xiao-Yang Liu, Hongtao Lu, Ruimin Shen	https://arxiv.org/find/cs/1/au:+Jiang_F/0/1/0/all/0/1,https://arxiv.org/find/cs/1/au:+Liu_X/0/1/0/all/0/1,https://arxiv.org/find/cs/1/au:+Lu_H/0/1/0/all/0/1,https://arxiv.org/find/cs/1/au:+Shen_R/0/1/0/all/0/1	Computer Vision and Pattern Recognition (cs.CV)	https://arxiv.org/abs/1703.09342.pdf
arXiv:1703.09296	Femoral ROIs and Entropy for Texture-based Detection of Osteoarthritis  from High-Resolution Knee Radiographs	https://arxiv.org/pdf/1703.09296.pdf	Jiří Hladůvka, Bui Thi Mai Phuong, Richard Ljuhar, Davul Ljuhar, Ana M Rodrigues, Jaime C Branco, Helena Canhão	https://arxiv.org/find/cs/1/au:+Hlad%5Cr%7Bu%7Dvka_J/0/1/0/all/0/1,https://arxiv.org/find/cs/1/au:+Phuong_B/0/1/0/all/0/1,https://arxiv.org/find/cs/1/au:+Ljuhar_R/0/1/0/all/0/1,https://arxiv.org/find/cs/1/au:+Ljuhar_D/0/1/0/all/0/1,https://arxiv.org/find/cs/1/au:+Rodrigues_A/0/1/0/all/0/1,https://arxiv.org/find/cs/1/au:+Branco_J/0/1/0/all/0/1,https://arxiv.org/find/cs/1/au:+Canhao_H/0/1/0/all/0/1	Computer Vision and Pattern Recognition (cs.CV)	https://arxiv.org/abs/1703.09296.pdf
arXiv:1703.09245	Discriminative Transfer Learning for General Image Restoration	https://arxiv.org/pdf/1703.09245.pdf	Lei Xiao, Felix Heide, Wolfgang Heidrich, Bernhard Schölkopf, Michael Hirsch	https://arxiv.org/find/cs/1/au:+Xiao_L/0/1/0/all/0/1,https://arxiv.org/find/cs/1/au:+Heide_F/0/1/0/all/0/1,https://arxiv.org/find/cs/1/au:+Heidrich_W/0/1/0/all/0/1,https://arxiv.org/find/cs/1/au:+Scholkopf_B/0/1/0/all/0/1,https://arxiv.org/find/cs/1/au:+Hirsch_M/0/1/0/all/0/1	Computer Vision and Pattern Recognition (cs.CV)	https://arxiv.org/abs/1703.09245.pdf
arXiv:1703.09387	Adversarial Transformation Networks: Learning to Generate Adversarial  Examples	https://arxiv.org/pdf/1703.09387.pdf	Shumeet Baluja, Ian Fischer	https://arxiv.org/find/cs/1/au:+Baluja_S/0/1/0/all/0/1,https://arxiv.org/find/cs/1/au:+Fischer_I/0/1/0/all/0/1	Neural and Evolutionary Computing (cs.NE)	https://arxiv.org/abs/1703.09387.pdf
arXiv:1703.09370	Ensembles of Deep LSTM Learners for Activity Recognition using Wearables	https://arxiv.org/pdf/1703.09370.pdf	Yu Guan, Thomas Ploetz	https://arxiv.org/find/cs/1/au:+Guan_Y/0/1/0/all/0/1,https://arxiv.org/find/cs/1/au:+Ploetz_T/0/1/0/all/0/1	Learning (cs.LG)	https://arxiv.org/abs/1703.09370.pdf
arXiv:1703.09211	Coherent Online Video Style Transfer	https://arxiv.org/pdf/1703.09211.pdf	Dongdong Chen, Jing Liao, Lu Yuan, Nenghai Yu, Gang Hua	https://arxiv.org/find/cs/1/au:+Chen_D/0/1/0/all/0/1,https://arxiv.org/find/cs/1/au:+Liao_J/0/1/0/all/0/1,https://arxiv.org/find/cs/1/au:+Yuan_L/0/1/0/all/0/1,https://arxiv.org/find/cs/1/au:+Yu_N/0/1/0/all/0/1,https://arxiv.org/find/cs/1/au:+Hua_G/0/1/0/all/0/1	Computer Vision and Pattern Recognition (cs.CV)	https://arxiv.org/abs/1703.09211.pdf
arXiv:1703.09210	StyleBank: An Explicit Representation for Neural Image Style Transfer	https://arxiv.org/pdf/1703.09210.pdf	Dongdong Chen, Lu Yuan, Jing Liao, Nenghai Yu, Gang Hua	https://arxiv.org/find/cs/1/au:+Chen_D/0/1/0/all/0/1,https://arxiv.org/find/cs/1/au:+Yuan_L/0/1/0/all/0/1,https://arxiv.org/find/cs/1/au:+Liao_J/0/1/0/all/0/1,https://arxiv.org/find/cs/1/au:+Yu_N/0/1/0/all/0/1,https://arxiv.org/find/cs/1/au:+Hua_G/0/1/0/all/0/1	Computer Vision and Pattern Recognition (cs.CV)	https://arxiv.org/abs/1703.09210.pdf
arXiv:1703.09200	Deep Poincare Map For Robust Medical Image Segmentation	https://arxiv.org/pdf/1703.09200.pdf	Yuanhan Mo, Fangde Liu, Jingqing Zhang, Guang Yang, Taigang He, Yike Guo	https://arxiv.org/find/cs/1/au:+Mo_Y/0/1/0/all/0/1,https://arxiv.org/find/cs/1/au:+Liu_F/0/1/0/all/0/1,https://arxiv.org/find/cs/1/au:+Zhang_J/0/1/0/all/0/1,https://arxiv.org/find/cs/1/au:+Yang_G/0/1/0/all/0/1,https://arxiv.org/find/cs/1/au:+He_T/0/1/0/all/0/1,https://arxiv.org/find/cs/1/au:+Guo_Y/0/1/0/all/0/1	Computer Vision and Pattern Recognition (cs.CV)	https://arxiv.org/abs/1703.09200.pdf
arXiv:1703.09199	Introduction To The Monogenic Signal	https://arxiv.org/pdf/1703.09199.pdf	Christopher P. Bridge	https://arxiv.org/find/cs/1/au:+Bridge_C/0/1/0/all/0/1	Computer Vision and Pattern Recognition (cs.CV)	https://arxiv.org/abs/1703.09199.pdf
arXiv:1703.09179	Transfer learning for music classification and regression tasks	https://arxiv.org/pdf/1703.09179.pdf	Keunwoo Choi, György Fazekas, Mark Sandler, Kyunghyun Cho	https://arxiv.org/find/cs/1/au:+Choi_K/0/1/0/all/0/1,https://arxiv.org/find/cs/1/au:+Fazekas_G/0/1/0/all/0/1,https://arxiv.org/find/cs/1/au:+Sandler_M/0/1/0/all/0/1,https://arxiv.org/find/cs/1/au:+Cho_K/0/1/0/all/0/1	Computer Vision and Pattern Recognition (cs.CV)	https://arxiv.org/abs/1703.09179.pdf
arXiv:1703.09167	A Study on the Extraction and Analysis of a Large Set of Eye Movement  Features during Reading	https://arxiv.org/pdf/1703.09167.pdf	Ioannis Rigas, Lee Friedman, Oleg Komogortsev	https://arxiv.org/find/cs/1/au:+Rigas_I/0/1/0/all/0/1,https://arxiv.org/find/cs/1/au:+Friedman_L/0/1/0/all/0/1,https://arxiv.org/find/cs/1/au:+Komogortsev_O/0/1/0/all/0/1	Computer Vision and Pattern Recognition (cs.CV)	https://arxiv.org/abs/1703.09167.pdf
arXiv:1703.09157	Reweighted Infrared Patch-Tensor Model With Both Non-Local and Local  Priors for Single-Frame Small Target Detection	https://arxiv.org/pdf/1703.09157.pdf	Yimian Dai, Yiquan Wu	https://arxiv.org/find/cs/1/au:+Dai_Y/0/1/0/all/0/1,https://arxiv.org/find/cs/1/au:+Wu_Y/0/1/0/all/0/1	Computer Vision and Pattern Recognition (cs.CV)	https://arxiv.org/abs/1703.09157.pdf
arXiv:1703.09145	Multi-Path Region-Based Convolutional Neural Network for Accurate  Detection of Unconstrained "Hard Faces"	https://arxiv.org/pdf/1703.09145.pdf	Yuguang Liu, Martin D. Levine	https://arxiv.org/find/cs/1/au:+Liu_Y/0/1/0/all/0/1,https://arxiv.org/find/cs/1/au:+Levine_M/0/1/0/all/0/1	Computer Vision and Pattern Recognition (cs.CV)	https://arxiv.org/abs/1703.09145.pdf
arXiv:1703.09076	Active Convolution: Learning the Shape of Convolution for Image  Classification	https://arxiv.org/pdf/1703.09076.pdf	Yunho Jeon, Junmo Kim	https://arxiv.org/find/cs/1/au:+Jeon_Y/0/1/0/all/0/1,https://arxiv.org/find/cs/1/au:+Kim_J/0/1/0/all/0/1	Computer Vision and Pattern Recognition (cs.CV)	https://arxiv.org/abs/1703.09076.pdf
arXiv:1703.09039	Efficient Processing of Deep Neural Networks: A Tutorial and Survey	https://arxiv.org/pdf/1703.09039.pdf	Vivienne Sze, Yu-Hsin Chen, Tien-Ju Yang, Joel Emer	https://arxiv.org/find/cs/1/au:+Sze_V/0/1/0/all/0/1,https://arxiv.org/find/cs/1/au:+Chen_Y/0/1/0/all/0/1,https://arxiv.org/find/cs/1/au:+Yang_T/0/1/0/all/0/1,https://arxiv.org/find/cs/1/au:+Emer_J/0/1/0/all/0/1	Computer Vision and Pattern Recognition (cs.CV)	https://arxiv.org/abs/1703.09039.pdf
arXiv:1703.09026	Trespassing the Boundaries: Labeling Temporal Bounds for Object  Interactions in Egocentric Video	https://arxiv.org/pdf/1703.09026.pdf	Davide Moltisanti, Michael Wray, Walterio Mayol-Cuevas, Dima Damen	https://arxiv.org/find/cs/1/au:+Moltisanti_D/0/1/0/all/0/1,https://arxiv.org/find/cs/1/au:+Wray_M/0/1/0/all/0/1,https://arxiv.org/find/cs/1/au:+Mayol_Cuevas_W/0/1/0/all/0/1,https://arxiv.org/find/cs/1/au:+Damen_D/0/1/0/all/0/1	Computer Vision and Pattern Recognition (cs.CV)	https://arxiv.org/abs/1703.09026.pdf
arXiv:1703.08987	Simultaneous Perception and Path Generation Using Fully Convolutional  Neural Networks	https://arxiv.org/pdf/1703.08987.pdf	Luca Caltagirone, Mauro Bellone, Lennart Svensson, Mattias Wahde	https://arxiv.org/find/cs/1/au:+Caltagirone_L/0/1/0/all/0/1,https://arxiv.org/find/cs/1/au:+Bellone_M/0/1/0/all/0/1,https://arxiv.org/find/cs/1/au:+Svensson_L/0/1/0/all/0/1,https://arxiv.org/find/cs/1/au:+Wahde_M/0/1/0/all/0/1	Computer Vision and Pattern Recognition (cs.CV)	https://arxiv.org/abs/1703.08987.pdf
arXiv:1703.08966	Mastering Sketching: Adversarial Augmentation for Structured Prediction	https://arxiv.org/pdf/1703.08966.pdf	Edgar Simo-Serra, Satoshi Iizuka, Hiroshi Ishikawa	https://arxiv.org/find/cs/1/au:+Simo_Serra_E/0/1/0/all/0/1,https://arxiv.org/find/cs/1/au:+Iizuka_S/0/1/0/all/0/1,https://arxiv.org/find/cs/1/au:+Ishikawa_H/0/1/0/all/0/1	Computer Vision and Pattern Recognition (cs.CV)	https://arxiv.org/abs/1703.08966.pdf
arXiv:1703.08961	Scaling the Scattering Transform: Deep Hybrid Networks	https://arxiv.org/pdf/1703.08961.pdf	Edouard Oyallon (DI-ENS), Eugene Belilovsky (CVN, GALEN), Sergey Zagoruyko (ENPC)	https://arxiv.org/find/cs/1/au:+Oyallon_E/0/1/0/all/0/1,https://arxiv.org/find/cs/1/au:+Belilovsky_E/0/1/0/all/0/1,https://arxiv.org/find/cs/1/au:+Zagoruyko_S/0/1/0/all/0/1	Computer Vision and Pattern Recognition (cs.CV)	https://arxiv.org/abs/1703.08961.pdf
arXiv:1703.08919	MIHash: Online Hashing with Mutual Information	https://arxiv.org/pdf/1703.08919.pdf	Fatih Cakir, Kun He, Sarah Adel Bargal, Stan Sclaroff	https://arxiv.org/find/cs/1/au:+Cakir_F/0/1/0/all/0/1,https://arxiv.org/find/cs/1/au:+He_K/0/1/0/all/0/1,https://arxiv.org/find/cs/1/au:+Bargal_S/0/1/0/all/0/1,https://arxiv.org/find/cs/1/au:+Sclaroff_S/0/1/0/all/0/1	Computer Vision and Pattern Recognition (cs.CV)	https://arxiv.org/abs/1703.08919.pdf
arXiv:1703.08917	A Visual Measure of Changes to Weighted Self-Organizing Map Patterns	https://arxiv.org/pdf/1703.08917.pdf	Younjin Chung, Joachim Gudmundsson, Masahiro Takatsuka	https://arxiv.org/find/cs/1/au:+Chung_Y/0/1/0/all/0/1,https://arxiv.org/find/cs/1/au:+Gudmundsson_J/0/1/0/all/0/1,https://arxiv.org/find/cs/1/au:+Takatsuka_M/0/1/0/all/0/1	Computer Vision and Pattern Recognition (cs.CV)	https://arxiv.org/abs/1703.08917.pdf
arXiv:1703.08912	Exploiting Color Name Space for Salient Object Detection	https://arxiv.org/pdf/1703.08912.pdf	Jing Lou, Huan Wang, Longtao Chen, Qingyuan Xia, Wei Zhu, Mingwu Ren	https://arxiv.org/find/cs/1/au:+Lou_J/0/1/0/all/0/1,https://arxiv.org/find/cs/1/au:+Wang_H/0/1/0/all/0/1,https://arxiv.org/find/cs/1/au:+Chen_L/0/1/0/all/0/1,https://arxiv.org/find/cs/1/au:+Xia_Q/0/1/0/all/0/1,https://arxiv.org/find/cs/1/au:+Zhu_W/0/1/0/all/0/1,https://arxiv.org/find/cs/1/au:+Ren_M/0/1/0/all/0/1	Computer Vision and Pattern Recognition (cs.CV)	https://arxiv.org/abs/1703.08912.pdf
arXiv:1703.08897	Transductive Zero-Shot Learning with Adaptive Structural Embedding	https://arxiv.org/pdf/1703.08897.pdf	Yunlong Yu, Zhong Ji, Jichang Guo, Yanwei Pang	https://arxiv.org/find/cs/1/au:+Yu_Y/0/1/0/all/0/1,https://arxiv.org/find/cs/1/au:+Ji_Z/0/1/0/all/0/1,https://arxiv.org/find/cs/1/au:+Guo_J/0/1/0/all/0/1,https://arxiv.org/find/cs/1/au:+Pang_Y/0/1/0/all/0/1	Computer Vision and Pattern Recognition (cs.CV)	https://arxiv.org/abs/1703.08897.pdf
arXiv:1703.08893	Transductive Zero-Shot Learning with a Self-training dictionary approach	https://arxiv.org/pdf/1703.08893.pdf	Yunlong Yu, Zhong Ji, Xi Li, Jichang Guo, Zhongfei Zhang, Haibin Ling, Fei Wu	https://arxiv.org/find/cs/1/au:+Yu_Y/0/1/0/all/0/1,https://arxiv.org/find/cs/1/au:+Ji_Z/0/1/0/all/0/1,https://arxiv.org/find/cs/1/au:+Li_X/0/1/0/all/0/1,https://arxiv.org/find/cs/1/au:+Guo_J/0/1/0/all/0/1,https://arxiv.org/find/cs/1/au:+Zhang_Z/0/1/0/all/0/1,https://arxiv.org/find/cs/1/au:+Ling_H/0/1/0/all/0/1,https://arxiv.org/find/cs/1/au:+Wu_F/0/1/0/all/0/1	Computer Vision and Pattern Recognition (cs.CV)	https://arxiv.org/abs/1703.08893.pdf
arXiv:1703.08866	Multi-View Deep Learning for Consistent Semantic Mapping with RGB-D  Cameras	https://arxiv.org/pdf/1703.08866.pdf	Lingni Ma, Jörg Stückler, Christian Kerl, Daniel Cremers	https://arxiv.org/find/cs/1/au:+Ma_L/0/1/0/all/0/1,https://arxiv.org/find/cs/1/au:+Stuckler_J/0/1/0/all/0/1,https://arxiv.org/find/cs/1/au:+Kerl_C/0/1/0/all/0/1,https://arxiv.org/find/cs/1/au:+Cremers_D/0/1/0/all/0/1	Computer Vision and Pattern Recognition (cs.CV)	https://arxiv.org/abs/1703.08866.pdf
arXiv:1703.08837	Person Re-Identification by Camera Correlation Aware Feature  Augmentation	https://arxiv.org/pdf/1703.08837.pdf	Ying-Cong Chen, Xiatian Zhu, Wei-Shi Zheng, Jian-Huang Lai	https://arxiv.org/find/cs/1/au:+Chen_Y/0/1/0/all/0/1,https://arxiv.org/find/cs/1/au:+Zhu_X/0/1/0/all/0/1,https://arxiv.org/find/cs/1/au:+Zheng_W/0/1/0/all/0/1,https://arxiv.org/find/cs/1/au:+Lai_J/0/1/0/all/0/1	Computer Vision and Pattern Recognition (cs.CV)	https://arxiv.org/abs/1703.08837.pdf
arXiv:1703.08836	Learned multi-patch similarity	https://arxiv.org/pdf/1703.08836.pdf	Wilfried Hartmann, Silvano Galliani, Michal Havlena, Konrad Schindler, Luc Van Gool	https://arxiv.org/find/cs/1/au:+Hartmann_W/0/1/0/all/0/1,https://arxiv.org/find/cs/1/au:+Galliani_S/0/1/0/all/0/1,https://arxiv.org/find/cs/1/au:+Havlena_M/0/1/0/all/0/1,https://arxiv.org/find/cs/1/au:+Schindler_K/0/1/0/all/0/1,https://arxiv.org/find/cs/1/au:+Gool_L/0/1/0/all/0/1	Computer Vision and Pattern Recognition (cs.CV)	https://arxiv.org/abs/1703.08836.pdf
arXiv:1703.08770	SCAN: Structure Correcting Adversarial Network for Chest X-rays Organ  Segmentation	https://arxiv.org/pdf/1703.08770.pdf	Wei Dai, Joseph Doyle, Xiaodan Liang, Hao Zhang, Nanqing Dong, Yuan Li, Eric P. Xing	https://arxiv.org/find/cs/1/au:+Dai_W/0/1/0/all/0/1,https://arxiv.org/find/cs/1/au:+Doyle_J/0/1/0/all/0/1,https://arxiv.org/find/cs/1/au:+Liang_X/0/1/0/all/0/1,https://arxiv.org/find/cs/1/au:+Zhang_H/0/1/0/all/0/1,https://arxiv.org/find/cs/1/au:+Dong_N/0/1/0/all/0/1,https://arxiv.org/find/cs/1/au:+Li_Y/0/1/0/all/0/1,https://arxiv.org/find/cs/1/au:+Xing_E/0/1/0/all/0/1	Computer Vision and Pattern Recognition (cs.CV)	https://arxiv.org/abs/1703.08770.pdf
arXiv:1703.08769	Open Vocabulary Scene Parsing	https://arxiv.org/pdf/1703.08769.pdf	Hang Zhao, Xavier Puig, Bolei Zhou, Sanja Fidler, Antonio Torralba	https://arxiv.org/find/cs/1/au:+Zhao_H/0/1/0/all/0/1,https://arxiv.org/find/cs/1/au:+Puig_X/0/1/0/all/0/1,https://arxiv.org/find/cs/1/au:+Zhou_B/0/1/0/all/0/1,https://arxiv.org/find/cs/1/au:+Fidler_S/0/1/0/all/0/1,https://arxiv.org/find/cs/1/au:+Torralba_A/0/1/0/all/0/1	Computer Vision and Pattern Recognition (cs.CV)	https://arxiv.org/abs/1703.08769.pdf
arXiv:1703.08764	Structured Learning of Tree Potentials in CRF for Image Segmentation	https://arxiv.org/pdf/1703.08764.pdf	Fayao Liu, Guosheng Lin, Ruizhi Qiao, Chunhua Shen	https://arxiv.org/find/cs/1/au:+Liu_F/0/1/0/all/0/1,https://arxiv.org/find/cs/1/au:+Lin_G/0/1/0/all/0/1,https://arxiv.org/find/cs/1/au:+Qiao_R/0/1/0/all/0/1,https://arxiv.org/find/cs/1/au:+Shen_C/0/1/0/all/0/1	Computer Vision and Pattern Recognition (cs.CV)	https://arxiv.org/abs/1703.08764.pdf
arXiv:1703.08738	Sketch-based Face Editing in Video Using Identity Deformation Transfer	https://arxiv.org/pdf/1703.08738.pdf	Long Zhao, Fangda Han, Mubbasir Kapadia, Vladimir Pavlovic, Dimitris Metaxas	https://arxiv.org/find/cs/1/au:+Zhao_L/0/1/0/all/0/1,https://arxiv.org/find/cs/1/au:+Han_F/0/1/0/all/0/1,https://arxiv.org/find/cs/1/au:+Kapadia_M/0/1/0/all/0/1,https://arxiv.org/find/cs/1/au:+Pavlovic_V/0/1/0/all/0/1,https://arxiv.org/find/cs/1/au:+Metaxas_D/0/1/0/all/0/1	Computer Vision and Pattern Recognition (cs.CV)	https://arxiv.org/abs/1703.08738.pdf
arXiv:1703.08710	Count-ception: Counting by Fully Convolutional Redundant Counting	https://arxiv.org/pdf/1703.08710.pdf	Joseph Paul Cohen, Henry Z. Lo, Yoshua Bengio	https://arxiv.org/find/cs/1/au:+Cohen_J/0/1/0/all/0/1,https://arxiv.org/find/cs/1/au:+Lo_H/0/1/0/all/0/1,https://arxiv.org/find/cs/1/au:+Bengio_Y/0/1/0/all/0/1	Computer Vision and Pattern Recognition (cs.CV)	https://arxiv.org/abs/1703.08710.pdf
arXiv:1703.08697	Improving the Accuracy of the CogniLearn System for Cognitive Behavior  Assessment	https://arxiv.org/pdf/1703.08697.pdf	Amir Ghaderi, Srujana Gattupalli, Dylan Ebert, Ali Sharifara, Vassilis Athitsos, Fillia Makedon	https://arxiv.org/find/cs/1/au:+Ghaderi_A/0/1/0/all/0/1,https://arxiv.org/find/cs/1/au:+Gattupalli_S/0/1/0/all/0/1,https://arxiv.org/find/cs/1/au:+Ebert_D/0/1/0/all/0/1,https://arxiv.org/find/cs/1/au:+Sharifara_A/0/1/0/all/0/1,https://arxiv.org/find/cs/1/au:+Athitsos_V/0/1/0/all/0/1,https://arxiv.org/find/cs/1/au:+Makedon_F/0/1/0/all/0/1	Computer Vision and Pattern Recognition (cs.CV)	https://arxiv.org/abs/1703.08697.pdf
arXiv:1703.08653	Bayesian Optimization for Refining Object Proposals	https://arxiv.org/pdf/1703.08653.pdf	Anthony D. Rhodes, Jordan Witte, Melanie Mitchell, Bruno Jedynak	https://arxiv.org/find/cs/1/au:+Rhodes_A/0/1/0/all/0/1,https://arxiv.org/find/cs/1/au:+Witte_J/0/1/0/all/0/1,https://arxiv.org/find/cs/1/au:+Mitchell_M/0/1/0/all/0/1,https://arxiv.org/find/cs/1/au:+Jedynak_B/0/1/0/all/0/1	Computer Vision and Pattern Recognition (cs.CV)	https://arxiv.org/abs/1703.08653.pdf
arXiv:1703.08651	More is Less: A More Complicated Network with Less Inference Complexity	https://arxiv.org/pdf/1703.08651.pdf	Xuanyi Dong, Junshi Huang, Yi Yang, Shuicheng Yan	https://arxiv.org/find/cs/1/au:+Dong_X/0/1/0/all/0/1,https://arxiv.org/find/cs/1/au:+Huang_J/0/1/0/all/0/1,https://arxiv.org/find/cs/1/au:+Yang_Y/0/1/0/all/0/1,https://arxiv.org/find/cs/1/au:+Yan_S/0/1/0/all/0/1	Computer Vision and Pattern Recognition (cs.CV)	https://arxiv.org/abs/1703.08651.pdf
arXiv:1703.08628	AMAT: Medial Axis Transform for Natural Images	https://arxiv.org/pdf/1703.08628.pdf	Stavros Tsogkas, Sven Dickinson	https://arxiv.org/find/cs/1/au:+Tsogkas_S/0/1/0/all/0/1,https://arxiv.org/find/cs/1/au:+Dickinson_S/0/1/0/all/0/1	Computer Vision and Pattern Recognition (cs.CV)	https://arxiv.org/abs/1703.08628.pdf
arXiv:1703.08617	Temporal Non-Volume Preserving Approach to Facial Age-Progression and  Age-Invariant Face Recognition	https://arxiv.org/pdf/1703.08617.pdf	Chi Nhan Duong, Kha Gia Quach, Khoa Luu, T. Hoang Ngan le, Marios Savvides	https://arxiv.org/find/cs/1/au:+Duong_C/0/1/0/all/0/1,https://arxiv.org/find/cs/1/au:+Quach_K/0/1/0/all/0/1,https://arxiv.org/find/cs/1/au:+Luu_K/0/1/0/all/0/1,https://arxiv.org/find/cs/1/au:+le_T/0/1/0/all/0/1,https://arxiv.org/find/cs/1/au:+Savvides_M/0/1/0/all/0/1	Computer Vision and Pattern Recognition (cs.CV)	https://arxiv.org/abs/1703.08617.pdf
arXiv:1703.08603	Adversarial Examples for Semantic Segmentation and Object Detection	https://arxiv.org/pdf/1703.08603.pdf	Cihang Xie, Jianyu Wang, Zhishuai Zhang, Yuyin Zhou, Lingxi Xie, Alan Yuille	https://arxiv.org/find/cs/1/au:+Xie_C/0/1/0/all/0/1,https://arxiv.org/find/cs/1/au:+Wang_J/0/1/0/all/0/1,https://arxiv.org/find/cs/1/au:+Zhang_Z/0/1/0/all/0/1,https://arxiv.org/find/cs/1/au:+Zhou_Y/0/1/0/all/0/1,https://arxiv.org/find/cs/1/au:+Xie_L/0/1/0/all/0/1,https://arxiv.org/find/cs/1/au:+Yuille_A/0/1/0/all/0/1	Computer Vision and Pattern Recognition (cs.CV)	https://arxiv.org/abs/1703.08603.pdf
arXiv:1703.08580	Deep Residual Learning for Instrument Segmentation in Robotic Surgery	https://arxiv.org/pdf/1703.08580.pdf	Daniil Pakhomov, Vittal Premachandran, Max Allan, Mahdi Azizian, Nassir Navab	https://arxiv.org/find/cs/1/au:+Pakhomov_D/0/1/0/all/0/1,https://arxiv.org/find/cs/1/au:+Premachandran_V/0/1/0/all/0/1,https://arxiv.org/find/cs/1/au:+Allan_M/0/1/0/all/0/1,https://arxiv.org/find/cs/1/au:+Azizian_M/0/1/0/all/0/1,https://arxiv.org/find/cs/1/au:+Navab_N/0/1/0/all/0/1	Computer Vision and Pattern Recognition (cs.CV)	https://arxiv.org/abs/1703.08580.pdf
arXiv:1703.09161	A Dynamic Programming Solution to Bounded Dejittering Problems	https://arxiv.org/pdf/1703.09161.pdf	Lukas F. Lang	https://arxiv.org/find/math/1/au:+Lang_L/0/1/0/all/0/1	Optimization and Control (math.OC)	https://arxiv.org/abs/1703.09161.pdf
arXiv:1703.09137	Where to put the Image in an Image Caption Generator	https://arxiv.org/pdf/1703.09137.pdf	Marc Tanti (1), Albert Gatt (1), Kenneth P. Camilleri (1) ((1) University of Malta)	https://arxiv.org/find/cs/1/au:+Tanti_M/0/1/0/all/0/1,https://arxiv.org/find/cs/1/au:+Gatt_A/0/1/0/all/0/1,https://arxiv.org/find/cs/1/au:+Camilleri_K/0/1/0/all/0/1	Neural and Evolutionary Computing (cs.NE)	https://arxiv.org/abs/1703.09137.pdf
arXiv:1703.08840	Inferring The Latent Structure of Human Decision-Making from Raw Visual  Inputs	https://arxiv.org/pdf/1703.08840.pdf	Yunzhu Li, Jiaming Song, Stefano Ermon	https://arxiv.org/find/cs/1/au:+Li_Y/0/1/0/all/0/1,https://arxiv.org/find/cs/1/au:+Song_J/0/1/0/all/0/1,https://arxiv.org/find/cs/1/au:+Ermon_S/0/1/0/all/0/1	Learning (cs.LG)	https://arxiv.org/abs/1703.08840.pdf
arXiv:1703.08774	Who Said What: Modeling Individual Labelers Improves Classification	https://arxiv.org/pdf/1703.08774.pdf	Melody Y. Guan, Varun Gulshan, Andrew M. Dai, Geoffrey E. Hinton	https://arxiv.org/find/cs/1/au:+Guan_M/0/1/0/all/0/1,https://arxiv.org/find/cs/1/au:+Gulshan_V/0/1/0/all/0/1,https://arxiv.org/find/cs/1/au:+Dai_A/0/1/0/all/0/1,https://arxiv.org/find/cs/1/au:+Hinton_G/0/1/0/all/0/1	Learning (cs.LG)	https://arxiv.org/abs/1703.08774.pdf
