arXiv:1703.10593	Unpaired Image-to-Image Translation using Cycle-Consistent Adversarial  Networks	https://arxiv.org/pdf/1703.10593.pdf	Jun-Yan Zhu, Taesung Park, Phillip Isola, Alexei A. Efros	https://arxiv.org/find/cs/1/au:+Zhu_J/0/1/0/all/0/1,https://arxiv.org/find/cs/1/au:+Park_T/0/1/0/all/0/1,https://arxiv.org/find/cs/1/au:+Isola_P/0/1/0/all/0/1,https://arxiv.org/find/cs/1/au:+Efros_A/0/1/0/all/0/1	Computer Vision and Pattern Recognition (cs.CV)	https://arxiv.org/abs/1703.10593.pdf
arXiv:1703.10584	Geometric Affordances from a Single Example via the Interaction Tensor	https://arxiv.org/pdf/1703.10584.pdf	Eduardo Ruiz, Walterio Mayol-Cuevas	https://arxiv.org/find/cs/1/au:+Ruiz_E/0/1/0/all/0/1,https://arxiv.org/find/cs/1/au:+Mayol_Cuevas_W/0/1/0/all/0/1	Computer Vision and Pattern Recognition (cs.CV)	https://arxiv.org/abs/1703.10584.pdf
arXiv:1703.10580	MoFA: Model-based Deep Convolutional Face Autoencoder for Unsupervised  Monocular Reconstruction	https://arxiv.org/pdf/1703.10580.pdf	Ayush Tewari, Michael Zollhöfer, Hyeongwoo Kim, Pablo Garrido, Florian Bernard, Patrick Pérez, Christian Theobalt	https://arxiv.org/find/cs/1/au:+Tewari_A/0/1/0/all/0/1,https://arxiv.org/find/cs/1/au:+Zollhofer_M/0/1/0/all/0/1,https://arxiv.org/find/cs/1/au:+Kim_H/0/1/0/all/0/1,https://arxiv.org/find/cs/1/au:+Garrido_P/0/1/0/all/0/1,https://arxiv.org/find/cs/1/au:+Bernard_F/0/1/0/all/0/1,https://arxiv.org/find/cs/1/au:+Perez_P/0/1/0/all/0/1,https://arxiv.org/find/cs/1/au:+Theobalt_C/0/1/0/all/0/1	Computer Vision and Pattern Recognition (cs.CV)	https://arxiv.org/abs/1703.10580.pdf
arXiv:1703.10571	Bootstrapping Labelled Dataset Construction for Cow Tracking and  Behavior Analysis	https://arxiv.org/pdf/1703.10571.pdf	Aram Ter-Sarkisov, Robert Ross, John Kelleher	https://arxiv.org/find/cs/1/au:+Ter_Sarkisov_A/0/1/0/all/0/1,https://arxiv.org/find/cs/1/au:+Ross_R/0/1/0/all/0/1,https://arxiv.org/find/cs/1/au:+Kelleher_J/0/1/0/all/0/1	Computer Vision and Pattern Recognition (cs.CV)	https://arxiv.org/abs/1703.10571.pdf
arXiv:1703.10553	Learning Convolutional Networks for Content-weighted Image Compression	https://arxiv.org/pdf/1703.10553.pdf	Mu Li, Wangmeng Zuo, Shuhang Gu, Debin Zhao, David Zhang	https://arxiv.org/find/cs/1/au:+Li_M/0/1/0/all/0/1,https://arxiv.org/find/cs/1/au:+Zuo_W/0/1/0/all/0/1,https://arxiv.org/find/cs/1/au:+Gu_S/0/1/0/all/0/1,https://arxiv.org/find/cs/1/au:+Zhao_D/0/1/0/all/0/1,https://arxiv.org/find/cs/1/au:+Zhang_D/0/1/0/all/0/1	Computer Vision and Pattern Recognition (cs.CV)	https://arxiv.org/abs/1703.10553.pdf
arXiv:1703.10530	Efficient optimization for Hierarchically-structured Interacting  Segments (HINTS)	https://arxiv.org/pdf/1703.10530.pdf	Hossam Isack, Olga Veksler, Ipek Oguz, Milan Sonka, Yuri Boykov	https://arxiv.org/find/cs/1/au:+Isack_H/0/1/0/all/0/1,https://arxiv.org/find/cs/1/au:+Veksler_O/0/1/0/all/0/1,https://arxiv.org/find/cs/1/au:+Oguz_I/0/1/0/all/0/1,https://arxiv.org/find/cs/1/au:+Sonka_M/0/1/0/all/0/1,https://arxiv.org/find/cs/1/au:+Boykov_Y/0/1/0/all/0/1	Computer Vision and Pattern Recognition (cs.CV)	https://arxiv.org/abs/1703.10530.pdf
arXiv:1703.10501	A Paradigm Shift: Detecting Human Rights Violations Through Web Images	https://arxiv.org/pdf/1703.10501.pdf	Grigorios Kalliatakis, Shoaib Ehsan, Klaus D. McDonald-Maier	https://arxiv.org/find/cs/1/au:+Kalliatakis_G/0/1/0/all/0/1,https://arxiv.org/find/cs/1/au:+Ehsan_S/0/1/0/all/0/1,https://arxiv.org/find/cs/1/au:+McDonald_Maier_K/0/1/0/all/0/1	Computer Vision and Pattern Recognition (cs.CV)	https://arxiv.org/abs/1703.10501.pdf
arXiv:1703.10480	A deep learning classification scheme based on augmented-enhanced  features to segment organs at risk on the optic region in brain cancer  patients	https://arxiv.org/pdf/1703.10480.pdf	Jose Dolz, Nicolas Reyns, Nacim Betrouni, Dris Kharroubi, Mathilde Quidet, Laurent Massoptier, Maximilien Vermandel	https://arxiv.org/find/cs/1/au:+Dolz_J/0/1/0/all/0/1,https://arxiv.org/find/cs/1/au:+Reyns_N/0/1/0/all/0/1,https://arxiv.org/find/cs/1/au:+Betrouni_N/0/1/0/all/0/1,https://arxiv.org/find/cs/1/au:+Kharroubi_D/0/1/0/all/0/1,https://arxiv.org/find/cs/1/au:+Quidet_M/0/1/0/all/0/1,https://arxiv.org/find/cs/1/au:+Massoptier_L/0/1/0/all/0/1,https://arxiv.org/find/cs/1/au:+Vermandel_M/0/1/0/all/0/1	Computer Vision and Pattern Recognition (cs.CV)	https://arxiv.org/abs/1703.10480.pdf
arXiv:1703.10476	Speaking the Same Language: Matching Machine to Human Captions by  Adversarial Training	https://arxiv.org/pdf/1703.10476.pdf	Rakshith Shetty, Marcus Rohrbach, Lisa Anne Hendricks, Mario Fritz, Bernt Schiele	https://arxiv.org/find/cs/1/au:+Shetty_R/0/1/0/all/0/1,https://arxiv.org/find/cs/1/au:+Rohrbach_M/0/1/0/all/0/1,https://arxiv.org/find/cs/1/au:+Hendricks_L/0/1/0/all/0/1,https://arxiv.org/find/cs/1/au:+Fritz_M/0/1/0/all/0/1,https://arxiv.org/find/cs/1/au:+Schiele_B/0/1/0/all/0/1	Computer Vision and Pattern Recognition (cs.CV)	https://arxiv.org/abs/1703.10476.pdf
arXiv:1703.10332	Dynamic Computational Time for Visual Attention	https://arxiv.org/pdf/1703.10332.pdf	Zhichao Li, Yi Yang, Xiao Liu, Shilei Wen, Wei Xu	https://arxiv.org/find/cs/1/au:+Li_Z/0/1/0/all/0/1,https://arxiv.org/find/cs/1/au:+Yang_Y/0/1/0/all/0/1,https://arxiv.org/find/cs/1/au:+Liu_X/0/1/0/all/0/1,https://arxiv.org/find/cs/1/au:+Wen_S/0/1/0/all/0/1,https://arxiv.org/find/cs/1/au:+Xu_W/0/1/0/all/0/1	Computer Vision and Pattern Recognition (cs.CV)	https://arxiv.org/abs/1703.10332.pdf
arXiv:1703.10304	Planecell: Representing the 3D Space with Planes	https://arxiv.org/pdf/1703.10304.pdf	Lei Fan, Ziyu Pan, Long Chen, Kai Huang	https://arxiv.org/find/cs/1/au:+Fan_L/0/1/0/all/0/1,https://arxiv.org/find/cs/1/au:+Pan_Z/0/1/0/all/0/1,https://arxiv.org/find/cs/1/au:+Chen_L/0/1/0/all/0/1,https://arxiv.org/find/cs/1/au:+Huang_K/0/1/0/all/0/1	Computer Vision and Pattern Recognition (cs.CV)	https://arxiv.org/abs/1703.10304.pdf
arXiv:1703.10295	DeNet: Scalable Real-time Object Detection with Directed Sparse Sampling	https://arxiv.org/pdf/1703.10295.pdf	Lachlan Tychsen-Smith, Lars Petersson	https://arxiv.org/find/cs/1/au:+Tychsen_Smith_L/0/1/0/all/0/1,https://arxiv.org/find/cs/1/au:+Petersson_L/0/1/0/all/0/1	Computer Vision and Pattern Recognition (cs.CV)	https://arxiv.org/abs/1703.10295.pdf
arXiv:1703.10277	Semantic Instance Segmentation via Deep Metric Learning	https://arxiv.org/pdf/1703.10277.pdf	Alireza Fathi, Zbigniew Wojna, Vivek Rathod, Peng Wang, Hyun Oh Song, Sergio Guadarrama, Kevin P. Murphy	https://arxiv.org/find/cs/1/au:+Fathi_A/0/1/0/all/0/1,https://arxiv.org/find/cs/1/au:+Wojna_Z/0/1/0/all/0/1,https://arxiv.org/find/cs/1/au:+Rathod_V/0/1/0/all/0/1,https://arxiv.org/find/cs/1/au:+Wang_P/0/1/0/all/0/1,https://arxiv.org/find/cs/1/au:+Song_H/0/1/0/all/0/1,https://arxiv.org/find/cs/1/au:+Guadarrama_S/0/1/0/all/0/1,https://arxiv.org/find/cs/1/au:+Murphy_K/0/1/0/all/0/1	Computer Vision and Pattern Recognition (cs.CV)	https://arxiv.org/abs/1703.10277.pdf
arXiv:1703.10239	SeGAN: Segmenting and Generating the Invisible	https://arxiv.org/pdf/1703.10239.pdf	Kiana Ehsani, Roozbeh Mottaghi, Ali Farhadi	https://arxiv.org/find/cs/1/au:+Ehsani_K/0/1/0/all/0/1,https://arxiv.org/find/cs/1/au:+Mottaghi_R/0/1/0/all/0/1,https://arxiv.org/find/cs/1/au:+Farhadi_A/0/1/0/all/0/1	Computer Vision and Pattern Recognition (cs.CV)	https://arxiv.org/abs/1703.10239.pdf
arXiv:1703.10217	Smartphone Based Colorimetric Detection via Machine Learning	https://arxiv.org/pdf/1703.10217.pdf	Ali Y. Mutlu, Volkan Kılıç, Gizem K. Özdemir, Abdullah Bayram, Nesrin Horzum, Mehmet E. Solmaz	https://arxiv.org/find/cs/1/au:+Mutlu_A/0/1/0/all/0/1,https://arxiv.org/find/cs/1/au:+Kilic_V/0/1/0/all/0/1,https://arxiv.org/find/cs/1/au:+Ozdemir_G/0/1/0/all/0/1,https://arxiv.org/find/cs/1/au:+Bayram_A/0/1/0/all/0/1,https://arxiv.org/find/cs/1/au:+Horzum_N/0/1/0/all/0/1,https://arxiv.org/find/cs/1/au:+Solmaz_M/0/1/0/all/0/1	Computer Vision and Pattern Recognition (cs.CV)	https://arxiv.org/abs/1703.10217.pdf
arXiv:1703.10200	Learning High Dynamic Range from Outdoor Panoramas	https://arxiv.org/pdf/1703.10200.pdf	Jinsong Zhang, Jean-François Lalonde	https://arxiv.org/find/cs/1/au:+Zhang_J/0/1/0/all/0/1,https://arxiv.org/find/cs/1/au:+Lalonde_J/0/1/0/all/0/1	Computer Vision and Pattern Recognition (cs.CV)	https://arxiv.org/abs/1703.10200.pdf
arXiv:1703.10196	Detecting Human Interventions on the Landscape: KAZE Features, Poisson  Point Processes, and a Construction Dataset	https://arxiv.org/pdf/1703.10196.pdf	Edward Boyda, Colin McCormick, Dan Hammer	https://arxiv.org/find/cs/1/au:+Boyda_E/0/1/0/all/0/1,https://arxiv.org/find/cs/1/au:+McCormick_C/0/1/0/all/0/1,https://arxiv.org/find/cs/1/au:+Hammer_D/0/1/0/all/0/1	Computer Vision and Pattern Recognition (cs.CV)	https://arxiv.org/abs/1703.10196.pdf
arXiv:1703.10155	CVAE-GAN: Fine-Grained Image Generation through Asymmetric Training	https://arxiv.org/pdf/1703.10155.pdf	Jianmin Bao, Dong Chen, Fang Wen, Houqiang Li, Gang Hua	https://arxiv.org/find/cs/1/au:+Bao_J/0/1/0/all/0/1,https://arxiv.org/find/cs/1/au:+Chen_D/0/1/0/all/0/1,https://arxiv.org/find/cs/1/au:+Wen_F/0/1/0/all/0/1,https://arxiv.org/find/cs/1/au:+Li_H/0/1/0/all/0/1,https://arxiv.org/find/cs/1/au:+Hua_G/0/1/0/all/0/1	Computer Vision and Pattern Recognition (cs.CV)	https://arxiv.org/abs/1703.10155.pdf
arXiv:1703.10131	Unrestricted Facial Geometry Reconstruction Using Image-to-Image  Translation	https://arxiv.org/pdf/1703.10131.pdf	Matan Sela, Elad Richardson, Ron Kimmel	https://arxiv.org/find/cs/1/au:+Sela_M/0/1/0/all/0/1,https://arxiv.org/find/cs/1/au:+Richardson_E/0/1/0/all/0/1,https://arxiv.org/find/cs/1/au:+Kimmel_R/0/1/0/all/0/1	Computer Vision and Pattern Recognition (cs.CV)	https://arxiv.org/abs/1703.10131.pdf
arXiv:1703.10125	Google Map Aided Visual Navigation for UAVs in GPS-denied Environment	https://arxiv.org/pdf/1703.10125.pdf	Mo Shan, Fei Wang, Feng Lin, Zhi Gao, Ya Z. Tang, Ben M. Chen	https://arxiv.org/find/cs/1/au:+Shan_M/0/1/0/all/0/1,https://arxiv.org/find/cs/1/au:+Wang_F/0/1/0/all/0/1,https://arxiv.org/find/cs/1/au:+Lin_F/0/1/0/all/0/1,https://arxiv.org/find/cs/1/au:+Gao_Z/0/1/0/all/0/1,https://arxiv.org/find/cs/1/au:+Tang_Y/0/1/0/all/0/1,https://arxiv.org/find/cs/1/au:+Chen_B/0/1/0/all/0/1	Computer Vision and Pattern Recognition (cs.CV)	https://arxiv.org/abs/1703.10125.pdf
arXiv:1703.10114	Improved Lossy Image Compression with Priming and Spatially Adaptive Bit  Rates for Recurrent Networks	https://arxiv.org/pdf/1703.10114.pdf	Nick Johnston, Damien Vincent, David Minnen, Michele Covell, Saurabh Singh, Troy Chinen, Sung Jin Hwang, Joel Shor, George Toderici	https://arxiv.org/find/cs/1/au:+Johnston_N/0/1/0/all/0/1,https://arxiv.org/find/cs/1/au:+Vincent_D/0/1/0/all/0/1,https://arxiv.org/find/cs/1/au:+Minnen_D/0/1/0/all/0/1,https://arxiv.org/find/cs/1/au:+Covell_M/0/1/0/all/0/1,https://arxiv.org/find/cs/1/au:+Singh_S/0/1/0/all/0/1,https://arxiv.org/find/cs/1/au:+Chinen_T/0/1/0/all/0/1,https://arxiv.org/find/cs/1/au:+Hwang_S/0/1/0/all/0/1,https://arxiv.org/find/cs/1/au:+Shor_J/0/1/0/all/0/1,https://arxiv.org/find/cs/1/au:+Toderici_G/0/1/0/all/0/1	Computer Vision and Pattern Recognition (cs.CV)	https://arxiv.org/abs/1703.10114.pdf
arXiv:1703.10106	Pose-conditioned Spatio-Temporal Attention for Human Action Recognition	https://arxiv.org/pdf/1703.10106.pdf	Fabien Baradel, Christian Wolf, Julien Mille	https://arxiv.org/find/cs/1/au:+Baradel_F/0/1/0/all/0/1,https://arxiv.org/find/cs/1/au:+Wolf_C/0/1/0/all/0/1,https://arxiv.org/find/cs/1/au:+Mille_J/0/1/0/all/0/1	Computer Vision and Pattern Recognition (cs.CV)	https://arxiv.org/abs/1703.10106.pdf
arXiv:1703.10025	Flow-Guided Feature Aggregation for Video Object Detection	https://arxiv.org/pdf/1703.10025.pdf	Xizhou Zhu, Yujie Wang, Jifeng Dai, Lu Yuan, Yichen Wei	https://arxiv.org/find/cs/1/au:+Zhu_X/0/1/0/all/0/1,https://arxiv.org/find/cs/1/au:+Wang_Y/0/1/0/all/0/1,https://arxiv.org/find/cs/1/au:+Dai_J/0/1/0/all/0/1,https://arxiv.org/find/cs/1/au:+Yuan_L/0/1/0/all/0/1,https://arxiv.org/find/cs/1/au:+Wei_Y/0/1/0/all/0/1	Computer Vision and Pattern Recognition (cs.CV)	https://arxiv.org/abs/1703.10025.pdf
arXiv:1703.09983	Iterative Object and Part Transfer for Fine-Grained Recognition	https://arxiv.org/pdf/1703.09983.pdf	Zhiqiang Shen, Yu-Gang Jiang, Dequan Wang, Xiangyang Xue	https://arxiv.org/find/cs/1/au:+Shen_Z/0/1/0/all/0/1,https://arxiv.org/find/cs/1/au:+Jiang_Y/0/1/0/all/0/1,https://arxiv.org/find/cs/1/au:+Wang_D/0/1/0/all/0/1,https://arxiv.org/find/cs/1/au:+Xue_X/0/1/0/all/0/1	Computer Vision and Pattern Recognition (cs.CV)	https://arxiv.org/abs/1703.09983.pdf
arXiv:1703.09971	A Geometric Framework for Stochastic Shape Analysis	https://arxiv.org/pdf/1703.09971.pdf	Alexis Arnaudon, Darryl D. Holm, Stefan Sommer	https://arxiv.org/find/cs/1/au:+Arnaudon_A/0/1/0/all/0/1,https://arxiv.org/find/cs/1/au:+Holm_D/0/1/0/all/0/1,https://arxiv.org/find/cs/1/au:+Sommer_S/0/1/0/all/0/1	Computer Vision and Pattern Recognition (cs.CV)	https://arxiv.org/abs/1703.09971.pdf
arXiv:1703.09964	Image Restoration using Autoencoding Priors	https://arxiv.org/pdf/1703.09964.pdf	Siavash Arjomand Bigdeli, Matthias Zwicker	https://arxiv.org/find/cs/1/au:+Bigdeli_S/0/1/0/all/0/1,https://arxiv.org/find/cs/1/au:+Zwicker_M/0/1/0/all/0/1	Computer Vision and Pattern Recognition (cs.CV)	https://arxiv.org/abs/1703.09964.pdf
arXiv:1703.09933	Sentiment Recognition in Egocentric Photostreams	https://arxiv.org/pdf/1703.09933.pdf	Estefania Talavera, Nicola Strisciuglio, Nicolai Petkov, Petia Radeva	https://arxiv.org/find/cs/1/au:+Talavera_E/0/1/0/all/0/1,https://arxiv.org/find/cs/1/au:+Strisciuglio_N/0/1/0/all/0/1,https://arxiv.org/find/cs/1/au:+Petkov_N/0/1/0/all/0/1,https://arxiv.org/find/cs/1/au:+Radeva_P/0/1/0/all/0/1	Computer Vision and Pattern Recognition (cs.CV)	https://arxiv.org/abs/1703.09933.pdf
arXiv:1703.09928	Bundle Optimization for Multi-aspect Embedding	https://arxiv.org/pdf/1703.09928.pdf	Qiong Zeng, Wenzheng Chen, Zhuo Han, Mingyi Shi, Yanir Kleiman, Daniel Cohen-Or, Baoquan Chen, Yangyan Li	https://arxiv.org/find/cs/1/au:+Zeng_Q/0/1/0/all/0/1,https://arxiv.org/find/cs/1/au:+Chen_W/0/1/0/all/0/1,https://arxiv.org/find/cs/1/au:+Han_Z/0/1/0/all/0/1,https://arxiv.org/find/cs/1/au:+Shi_M/0/1/0/all/0/1,https://arxiv.org/find/cs/1/au:+Kleiman_Y/0/1/0/all/0/1,https://arxiv.org/find/cs/1/au:+Cohen_Or_D/0/1/0/all/0/1,https://arxiv.org/find/cs/1/au:+Chen_B/0/1/0/all/0/1,https://arxiv.org/find/cs/1/au:+Li_Y/0/1/0/all/0/1	Computer Vision and Pattern Recognition (cs.CV)	https://arxiv.org/abs/1703.09928.pdf
arXiv:1703.09916	Towards thinner convolutional neural networks through Gradually Global  Pruning	https://arxiv.org/pdf/1703.09916.pdf	Zhengtao Wang, Ce Zhu, Zhiqiang Xia, Qi Guo, Yipeng Liu	https://arxiv.org/find/cs/1/au:+Wang_Z/0/1/0/all/0/1,https://arxiv.org/find/cs/1/au:+Zhu_C/0/1/0/all/0/1,https://arxiv.org/find/cs/1/au:+Xia_Z/0/1/0/all/0/1,https://arxiv.org/find/cs/1/au:+Guo_Q/0/1/0/all/0/1,https://arxiv.org/find/cs/1/au:+Liu_Y/0/1/0/all/0/1	Computer Vision and Pattern Recognition (cs.CV)	https://arxiv.org/abs/1703.09916.pdf
arXiv:1703.09913	Who's Better, Who's Best: Skill Determination in Video using Deep  Ranking	https://arxiv.org/pdf/1703.09913.pdf	Hazel Doughty, Dima Damen, Walterio Mayol-Cuevas	https://arxiv.org/find/cs/1/au:+Doughty_H/0/1/0/all/0/1,https://arxiv.org/find/cs/1/au:+Damen_D/0/1/0/all/0/1,https://arxiv.org/find/cs/1/au:+Mayol_Cuevas_W/0/1/0/all/0/1	Computer Vision and Pattern Recognition (cs.CV)	https://arxiv.org/abs/1703.09913.pdf
arXiv:1703.09912	One Network to Solve Them All --- Solving Linear Inverse Problems using  Deep Projection Models	https://arxiv.org/pdf/1703.09912.pdf	J. H. Rick Chang, Chun-Liang Li, Barnabas Poczos, B. V. K. Vijaya Kumar, Aswin C. Sankaranarayanan	https://arxiv.org/find/cs/1/au:+Chang_J/0/1/0/all/0/1,https://arxiv.org/find/cs/1/au:+Li_C/0/1/0/all/0/1,https://arxiv.org/find/cs/1/au:+Poczos_B/0/1/0/all/0/1,https://arxiv.org/find/cs/1/au:+Kumar_B/0/1/0/all/0/1,https://arxiv.org/find/cs/1/au:+Sankaranarayanan_A/0/1/0/all/0/1	Computer Vision and Pattern Recognition (cs.CV)	https://arxiv.org/abs/1703.09912.pdf
arXiv:1703.09911	Learning with Privileged Information for Multi-Label Classification	https://arxiv.org/pdf/1703.09911.pdf	Shiyu Chen, Shangfei Wang, Tanfang Chen, Xiaoxiao Shi	https://arxiv.org/find/cs/1/au:+Chen_S/0/1/0/all/0/1,https://arxiv.org/find/cs/1/au:+Wang_S/0/1/0/all/0/1,https://arxiv.org/find/cs/1/au:+Chen_T/0/1/0/all/0/1,https://arxiv.org/find/cs/1/au:+Shi_X/0/1/0/all/0/1	Computer Vision and Pattern Recognition (cs.CV)	https://arxiv.org/abs/1703.09911.pdf
arXiv:1703.09891	LabelBank: Revisiting Global Perspectives for Semantic Segmentation	https://arxiv.org/pdf/1703.09891.pdf	Hexiang Hu, Zhiwei Deng, Guang-Tong Zhou, Fei Sha, Greg Mori	https://arxiv.org/find/cs/1/au:+Hu_H/0/1/0/all/0/1,https://arxiv.org/find/cs/1/au:+Deng_Z/0/1/0/all/0/1,https://arxiv.org/find/cs/1/au:+Zhou_G/0/1/0/all/0/1,https://arxiv.org/find/cs/1/au:+Sha_F/0/1/0/all/0/1,https://arxiv.org/find/cs/1/au:+Mori_G/0/1/0/all/0/1	Computer Vision and Pattern Recognition (cs.CV)	https://arxiv.org/abs/1703.09891.pdf
arXiv:1703.09880	Novel Structured Low-rank algorithm to recover spatially smooth  exponential image time series	https://arxiv.org/pdf/1703.09880.pdf	Arvind Balachandrasekaran, Mathews Jacob	https://arxiv.org/find/cs/1/au:+Balachandrasekaran_A/0/1/0/all/0/1,https://arxiv.org/find/cs/1/au:+Jacob_M/0/1/0/all/0/1	Computer Vision and Pattern Recognition (cs.CV)	https://arxiv.org/abs/1703.09880.pdf
arXiv:1703.09859	Click Here: Human-Localized Keypoints as Guidance for Viewpoint  Estimation	https://arxiv.org/pdf/1703.09859.pdf	Ryan Szeto, Jason J. Corso	https://arxiv.org/find/cs/1/au:+Szeto_R/0/1/0/all/0/1,https://arxiv.org/find/cs/1/au:+Corso_J/0/1/0/all/0/1	Computer Vision and Pattern Recognition (cs.CV)	https://arxiv.org/abs/1703.09859.pdf
arXiv:1703.09856	Automatic Detection of Knee Joints and Quantification of Knee  Osteoarthritis Severity using Convolutional Neural Networks	https://arxiv.org/pdf/1703.09856.pdf	Joseph Antony, Kevin McGuinness, Kieran Moran, Noel E O'Connor	https://arxiv.org/find/cs/1/au:+Antony_J/0/1/0/all/0/1,https://arxiv.org/find/cs/1/au:+McGuinness_K/0/1/0/all/0/1,https://arxiv.org/find/cs/1/au:+Moran_K/0/1/0/all/0/1,https://arxiv.org/find/cs/1/au:+OConnor_N/0/1/0/all/0/1	Computer Vision and Pattern Recognition (cs.CV)	https://arxiv.org/abs/1703.09856.pdf
arXiv:1703.09793	Deceiving Google's Cloud Video Intelligence API Built for Summarizing  Videos	https://arxiv.org/pdf/1703.09793.pdf	Hossein Hosseini, Baicen Xiao, Radha Poovendran	https://arxiv.org/find/cs/1/au:+Hosseini_H/0/1/0/all/0/1,https://arxiv.org/find/cs/1/au:+Xiao_B/0/1/0/all/0/1,https://arxiv.org/find/cs/1/au:+Poovendran_R/0/1/0/all/0/1	Computer Vision and Pattern Recognition (cs.CV)	https://arxiv.org/abs/1703.09793.pdf
arXiv:1703.09788	ProcNets: Learning to Segment Procedures in Untrimmed and Unconstrained  Videos	https://arxiv.org/pdf/1703.09788.pdf	Luowei Zhou, Chenliang Xu, Jason J. Corso	https://arxiv.org/find/cs/1/au:+Zhou_L/0/1/0/all/0/1,https://arxiv.org/find/cs/1/au:+Xu_C/0/1/0/all/0/1,https://arxiv.org/find/cs/1/au:+Corso_J/0/1/0/all/0/1	Computer Vision and Pattern Recognition (cs.CV)	https://arxiv.org/abs/1703.09788.pdf
arXiv:1703.09784	Perception Driven Texture Generation	https://arxiv.org/pdf/1703.09784.pdf	Yanhai Gan, Huifang Chi, Ying Gao, Jun Liu, Guoqiang Zhong, Junyu Dong	https://arxiv.org/find/cs/1/au:+Gan_Y/0/1/0/all/0/1,https://arxiv.org/find/cs/1/au:+Chi_H/0/1/0/all/0/1,https://arxiv.org/find/cs/1/au:+Gao_Y/0/1/0/all/0/1,https://arxiv.org/find/cs/1/au:+Liu_J/0/1/0/all/0/1,https://arxiv.org/find/cs/1/au:+Zhong_G/0/1/0/all/0/1,https://arxiv.org/find/cs/1/au:+Dong_J/0/1/0/all/0/1	Computer Vision and Pattern Recognition (cs.CV)	https://arxiv.org/abs/1703.09784.pdf
arXiv:1703.09783	Two-Stream RNN/CNN for Action Recognition in 3D Videos	https://arxiv.org/pdf/1703.09783.pdf	Rui Zhao, Haider Ali, Patrick van der Smagt	https://arxiv.org/find/cs/1/au:+Zhao_R/0/1/0/all/0/1,https://arxiv.org/find/cs/1/au:+Ali_H/0/1/0/all/0/1,https://arxiv.org/find/cs/1/au:+Smagt_P/0/1/0/all/0/1	Computer Vision and Pattern Recognition (cs.CV)	https://arxiv.org/abs/1703.09783.pdf
arXiv:1703.09779	A Holistic Approach for Optimizing DSP Block Utilization of a CNN  implementation on FPGA	https://arxiv.org/pdf/1703.09779.pdf	Kamel Abdelouahab, Cedric Bourrasset, Maxime Pelcat, François Berry, Jean-Charles Quinton, Jocelyn Serot	https://arxiv.org/find/cs/1/au:+Abdelouahab_K/0/1/0/all/0/1,https://arxiv.org/find/cs/1/au:+Bourrasset_C/0/1/0/all/0/1,https://arxiv.org/find/cs/1/au:+Pelcat_M/0/1/0/all/0/1,https://arxiv.org/find/cs/1/au:+Berry_F/0/1/0/all/0/1,https://arxiv.org/find/cs/1/au:+Quinton_J/0/1/0/all/0/1,https://arxiv.org/find/cs/1/au:+Serot_J/0/1/0/all/0/1	Computer Vision and Pattern Recognition (cs.CV)	https://arxiv.org/abs/1703.09779.pdf
arXiv:1703.09778	INTEL-TUT Dataset for Camera Invariant Color Constancy Research	https://arxiv.org/pdf/1703.09778.pdf	Caglar Aytekin, Jarno Nikkanen, Moncef Gabbouj	https://arxiv.org/find/cs/1/au:+Aytekin_C/0/1/0/all/0/1,https://arxiv.org/find/cs/1/au:+Nikkanen_J/0/1/0/all/0/1,https://arxiv.org/find/cs/1/au:+Gabbouj_M/0/1/0/all/0/1	Computer Vision and Pattern Recognition (cs.CV)	https://arxiv.org/abs/1703.09778.pdf
arXiv:1703.09771	Deep 6-DOF Tracking	https://arxiv.org/pdf/1703.09771.pdf	Mathieu Garon, Jean-François Lalonde	https://arxiv.org/find/cs/1/au:+Garon_M/0/1/0/all/0/1,https://arxiv.org/find/cs/1/au:+Lalonde_J/0/1/0/all/0/1	Computer Vision and Pattern Recognition (cs.CV)	https://arxiv.org/abs/1703.09771.pdf
arXiv:1703.09746	Coordinating Filters for Faster Deep Neural Networks	https://arxiv.org/pdf/1703.09746.pdf	Wei Wen, Cong Xu, Chunpeng Wu, Yandan Wang, Yiran Chen, Hai Li	https://arxiv.org/find/cs/1/au:+Wen_W/0/1/0/all/0/1,https://arxiv.org/find/cs/1/au:+Xu_C/0/1/0/all/0/1,https://arxiv.org/find/cs/1/au:+Wu_C/0/1/0/all/0/1,https://arxiv.org/find/cs/1/au:+Wang_Y/0/1/0/all/0/1,https://arxiv.org/find/cs/1/au:+Chen_Y/0/1/0/all/0/1,https://arxiv.org/find/cs/1/au:+Li_H/0/1/0/all/0/1	Computer Vision and Pattern Recognition (cs.CV)	https://arxiv.org/abs/1703.09746.pdf
arXiv:1703.09744	Feature Analysis and Selection for Training an End-to-End Autonomous  Vehicle Controller Using the Deep Learning Approach	https://arxiv.org/pdf/1703.09744.pdf	Shun Yang, Wenshuo Wang, Chang Liu, Kevin Deng, J. Karl Hedrick	https://arxiv.org/find/cs/1/au:+Yang_S/0/1/0/all/0/1,https://arxiv.org/find/cs/1/au:+Wang_W/0/1/0/all/0/1,https://arxiv.org/find/cs/1/au:+Liu_C/0/1/0/all/0/1,https://arxiv.org/find/cs/1/au:+Deng_K/0/1/0/all/0/1,https://arxiv.org/find/cs/1/au:+Hedrick_J/0/1/0/all/0/1	Computer Vision and Pattern Recognition (cs.CV)	https://arxiv.org/abs/1703.09744.pdf
arXiv:1703.09725	An Epipolar Line from a Single Pixel	https://arxiv.org/pdf/1703.09725.pdf	Tavi Halperin, Michael Werman	https://arxiv.org/find/cs/1/au:+Halperin_T/0/1/0/all/0/1,https://arxiv.org/find/cs/1/au:+Werman_M/0/1/0/all/0/1	Computer Vision and Pattern Recognition (cs.CV)	https://arxiv.org/abs/1703.09725.pdf
arXiv:1703.09833	Theory II: Landscape of the Empirical Risk in Deep Learning	https://arxiv.org/pdf/1703.09833.pdf	Tomaso Poggio, Qianli Liao	https://arxiv.org/find/cs/1/au:+Poggio_T/0/1/0/all/0/1,https://arxiv.org/find/cs/1/au:+Liao_Q/0/1/0/all/0/1	Learning (cs.LG)	https://arxiv.org/abs/1703.09833.pdf
arXiv:1703.09695	Semi and Weakly Supervised Semantic Segmentation Using Generative  Adversarial Network	https://arxiv.org/pdf/1703.09695.pdf	Nasim Souly, Concetto Spampinato, Mubarak Shah	https://arxiv.org/find/cs/1/au:+Souly_N/0/1/0/all/0/1,https://arxiv.org/find/cs/1/au:+Spampinato_C/0/1/0/all/0/1,https://arxiv.org/find/cs/1/au:+Shah_M/0/1/0/all/0/1	Computer Vision and Pattern Recognition (cs.CV)	https://arxiv.org/abs/1703.09695.pdf
arXiv:1703.09690	Efficient Two-Dimensional Sparse Coding Using Tensor-Linear Combination	https://arxiv.org/pdf/1703.09690.pdf	Fei Jiang, Xiao-Yang Liu, Hongtao Lu, Ruimin Shen	https://arxiv.org/find/cs/1/au:+Jiang_F/0/1/0/all/0/1,https://arxiv.org/find/cs/1/au:+Liu_X/0/1/0/all/0/1,https://arxiv.org/find/cs/1/au:+Lu_H/0/1/0/all/0/1,https://arxiv.org/find/cs/1/au:+Shen_R/0/1/0/all/0/1	Computer Vision and Pattern Recognition (cs.CV)	https://arxiv.org/abs/1703.09690.pdf
arXiv:1703.09684	An Analysis of Visual Question Answering Algorithms	https://arxiv.org/pdf/1703.09684.pdf	Kushal Kafle, Christopher Kanan	https://arxiv.org/find/cs/1/au:+Kafle_K/0/1/0/all/0/1,https://arxiv.org/find/cs/1/au:+Kanan_C/0/1/0/all/0/1	Computer Vision and Pattern Recognition (cs.CV)	https://arxiv.org/abs/1703.09684.pdf
arXiv:1703.09625	Learning and Refining of Privileged Information-based RNNs for Action  Recognition from Depth Sequences	https://arxiv.org/pdf/1703.09625.pdf	Zhiyuan Shi, Tae-Kyun Kim	https://arxiv.org/find/cs/1/au:+Shi_Z/0/1/0/all/0/1,https://arxiv.org/find/cs/1/au:+Kim_T/0/1/0/all/0/1	Computer Vision and Pattern Recognition (cs.CV)	https://arxiv.org/abs/1703.09625.pdf
arXiv:1703.09554	Lucid Data Dreaming for Object Tracking	https://arxiv.org/pdf/1703.09554.pdf	Anna Khoreva, Rodrigo Benenson, Eddy Ilg, Thomas Brox, Bernt Schiele	https://arxiv.org/find/cs/1/au:+Khoreva_A/0/1/0/all/0/1,https://arxiv.org/find/cs/1/au:+Benenson_R/0/1/0/all/0/1,https://arxiv.org/find/cs/1/au:+Ilg_E/0/1/0/all/0/1,https://arxiv.org/find/cs/1/au:+Brox_T/0/1/0/all/0/1,https://arxiv.org/find/cs/1/au:+Schiele_B/0/1/0/all/0/1	Computer Vision and Pattern Recognition (cs.CV)	https://arxiv.org/abs/1703.09554.pdf
